Department,University,City/Cities,Marks required,Labs Avalible,Course Description,Admission dates,shifts,online,offered courses,clean_text
"Computing & IT, Engineering, Health Sciences, Life Sciences, Management Sciences, Social Sciences, Pharmacy",Abasyn University,"Islamabad, Peshawar",60,Yes,"Abasyn University offers professional and academic degree programs focusing on practical skills, lab work, and industry-oriented education. Programs include computing, engineering, pharmacy, health sciences, life sciences, business, and social sciences. Courses combine theory, labs, projects, and internships to prepare students for professional careers.","January , February , July , August","Morning ,Evening",no,"MA (English, Education, etc.)

MBA

MS (Computer Science, Management, Engineering, etc.)

MPhil

PhD ,BS Computer Science

BS Software Engineering

BS Data Science

BS Artificial Intelligence

BS Cyber Security

BS Information Technology

BE Civil Engineering

BE Electrical Engineering

BS Microbiology

BS Biotechnology

BS Food Science & Nutrition

Doctor of Pharmacy (Pharm-D)

Doctor of Physical Therapy (DPT)

BBA

BS Accounting & Finance

BS English

BS Psychology",abasyn university offer professional academic degree program focus practical skill   lab work   industry orient education   program include compute   engineering   pharmacy   health science   life sciences   business   social science   course combine theory   lab   project   internship prepare student professional career
"Microbiology, Medical Lab Technology, Pharmacy, Food Science & Technology, Computer Science, Software Engineering, Chemistry, Mathematics, Physics, Zoology, Earth Sciences, Economics, Management Sciences, Psychology, English, Pakistan Studies, International Relations, Business Administration, Banking & Finance, Tourism & Hospitality, Education, and other BS/MS/MPhil/PhD streams",Abbottabad University of Science and Technology (AUST),Abbottabad,50,Yes,"Offers undergraduate, graduate and postgraduate degrees with emphasis on theory, practical labs, research, and applied skills across sciences, technology, business and social sciences ","July , August","Morning, Evening",in critical situations,"Pharm-D, BS Microbiology, BS Medical Lab Technology (MLT), BS Food Science & Technology, BS Computer Science, BS Software Engineering, BS Mathematics, BS Physics, BS Chemistry, BS Zoology, BS Earth Sciences, BBA, BS Economics, BS Banking & Finance, BS Tourism & Hospitality, BS Psychology, BS English, BS Pakistan Studies, MSc/MS degrees in various areas, MPhil, PhD ",offer undergraduate   graduate postgraduate degree emphasis theory   practical lab   research   apply skill science   technology   business social science
"Faculty of Arts & Humanities, Faculty of Agriculture, Faculty of Business & Economics, Faculty of Chemical & Life Sciences, Faculty of Technologies & Engineering Sciences, Faculty of Numerical & Physical Sciences, Faculty of Social Sciences, Institute of Business Studies & Leadership, Computer Science, Education, Pharmacy, Law, Economics, Management Sciences, Botany, Biotechnology, Chemistry, Microbiology, Zoology, Physics, Mathematics, Statistics, Geology, Environmental Sciences, International Relations, Political Science, Tourism & Hospitality, Physical Education, Psychology, English, Agriculture & Food Sciences, Animal Sciences, Environmental Health & Safety, Design & Fine Arts and many BS/MS/MPhil/PhD disciplines",Abdul Wali Khan University,"Mardan, Pabbi (Nowshera campus), Timergara",50,yes,"Offers undergraduate, graduate, postgraduate and research-oriented programs across sciences, arts, business, technology, agriculture, life sciences and social sciences, combining theoretical study, practical labs, research projects and professional skill development","June,July","Morning, Evening",no,"BS Agriculture, BS Food Science & Technology, BS Archaeology, BBA, BS Banking & Finance, BS Commerce, BS Economics, BS Computer Science, BS English, BS Physics, BS Chemistry, BS Biotechnology, BS Botany, BS Zoology, BS Environmental Sciences, BS Tourism & Hospitality, BS Mathematics, BS Statistics, BS Psychology, BS Environmental Health & Safety, Pharm-D, LLB (Law), B.Ed, BS Education, MS Computer Science, MS Economics, MPhil Education, PhD Chemistry, PhD Computer Science, PhD Economics, and many other MA/MS/MPhil/PhD programs across disciplines",offer undergraduate   graduate   postgraduate research orient program science   art   business   technology   agriculture   life science social science   combine theoretical study   practical lab   research project professional skill development
"Faculty of Arts & Sciences, School of Nursing & Midwifery, Medical College (Medicine), Graduate & Postgraduate Studies (Public Health, Health Management, Education, Biological & Biomedical Sciences, Epidemiology, Bioethics, Healthcare Management)",Aga Khan University,"Karachi (Pakistan),",60,Yes,"Offers world-class education focused on health sciences, medicine, nursing, arts & sciences, public health, research, leadership and community service with strong emphasis on research, clinical practice, experiential learning and interdisciplinary study",, Morning,Yes,"MBBS, BS Arts & Sciences, BSc Nursing, Post-RN BScN, BSc Midwifery, Masters in Public Health, Health Policy & Management, Education, Bioethics, MS, MPhil, PhD",offer world class education focus health science   medicine   nursing   art    science   public health   research   leadership community service strong emphasis research   clinical practice   experiential learning interdisciplinary study
"Engineering, Computing & AI, Aerospace & Aviation, Management Sciences, Social Sciences, Basic Sciences","Air University, Islamabad","Islamabad, Multan, Kamra

Online classes : Sometimes (mainly on-campu",60,Yes,"Internationally recognized university focused on medicine, health sciences, nursing, research, leadership, and community development","October,January","Morning, Evening",no,"BS Computer Science, BS Software Engineering, BS AI, BS Cyber Security, BE Electrical Engineering, BE Mechanical Engineering, BE Aerospace Engineering, BBA, BS Economics, BS Mathematics, MS, MBA, MPhil, PhD",internationally recognize university focus medicine   health sciences   nursing   research   leadership   community development
"Strategic Studies, National Security & Strategic Leadership, Military Research (professional military education)","Air War College Institute, Karachi",Karachi,60,no,"A specialized degree?awarding military institute for mid?career and senior officers of Pakistan armed forces, focusing on advanced national security, strategic studies, military leadership, joint operations and research; awards MS National Security & Strategic Studies upon completion",depend on military term schedule,Day ,no,"Air War Course (AWC), Air Command & Staff Course (AC&SC), MS in National Security & Strategic Studies",specialized degree award military institute mid career senior officer pakistan armed force   focus advanced national security   strategic study   military leadership   joint operation research   award ms national security    strategic study completion
"GeneralIslamic Studies, Education, Law/Shariah, Management & Business, Computer Science (general faculties)","Al-Ghazali University, Karachi",Karachi,60,Yes,"A public Islamic university combining religious education with contemporary academic programs such as Islamic Finance, Computer Science, Business & Education; emphasizes tradition and modern knowledge integration","August , September","Morning, Possibly some Evening",sometinme,"BS Computer Science, BS Islamic Studies, BS Islamic Finance, BS Shariah & Finance, BBA, BS Education, MS Islamic Banking & Finance, MS Islamic Studies (multiple tracks)",public islamic university combine religious education contemporary academic program islamic finance   computer science   business    education   emphasize tradition modern knowledge integration
"Computer Science, Islamic Studies, Arts & Humanities, Social Sciences, possibly Engineering & Education (general pattern for private Islamic university offerings)",Al-Hamd Islamic University,Quetta (and possible Islamabad campus),60,yes,"A degree?awarding institution offering a blend of Islamic education and modern academic programs including computing, business and humanities, aiming to integrate ethical values with professional skills","July,August","Morning, Possibly Evening",sometime,"BS Computer Science, BBA, BS Economics, Islamic Studies, Education, various postgraduate programs",degree award institution offer blend islamic education modern academic program include compute   business humanity   aim integrate ethical value professional skill
"Education & Teacher Training, Professional Development, Instructional Design",Ali Institute of Education,Lahore,60,yes,"A private institute specializing in teacher education and professional development, offering pre?service and in?service training, diplomas, bachelors and postgraduate programs focused on modern teaching methods, curriculum design, and educational leadership","June,August","Morning, Some flexible scheduling for workshops / diplomas",yes,"B.Ed., M.Ed., Post Graduate Diploma in Education (PGDE), Post Graduate Diploma in Education Leadership & Management, Diploma & certificate programs in teaching, online professional courses",private institute specialize teacher education professional development   offer pre service service training   diploma   bachelor s postgraduate program focus modern teaching method   curriculum design   educational leadership
"Business, Management & General Studies (typical for private institute)","Al-Karam International Institute, Bhera",Bhera (Sargodha District),60,yes,"A private educational institute offering undergraduate and professional programs in business, management, and allied sciences with a focus on practical industry skills and employability","July, August","Morning, Evening",Sometimes ,"BBA, BS Accounting & Finance, BS Computer Science, and other related programs",private educational institute offering undergraduate professional program business   management   ally science focus practical industry skill employability
"Islamic Studies, Computer Science & IT, Business & Management, Education, Psychology, Accounting & Finance (BS & UG programs)","Al-Kawthar University, Karachi",Karachi,60,yes,"A private Islamic university integrating modern academic subjects with Islamic values; offers undergraduate programs in computing, business, education, social science, and humanities with practical and ethical focus","July, August","Morning, Evening",sometime,"BS Computer Science, BS Information Technology, BBA, BS English, BS Islamic Studies, BS Psychology, BS Accounting & Finance, B.Ed (Hons)",private islamic university integrate modern academic subject islamic value   offer undergraduate program compute   business   education   social science   humanity practical ethical focus
"Management Sciences, Computer Science, Education, Social Sciences, Business & Commerce",Al-Khair University,Bhimber (Azad Jammu & Kashmir),60,yes,"Private university aiming to develop skilled professionals in management, IT, education and social sciences; emphasizes teaching, research and service with practical skill building",Spring & Fall cycles,"Morning, Evening",sometime,"BS Computer Science, BS IT, BBA, Master in IT, Master in Commerce (MCom), MS/MPhil in related fields",private university aim develop skilled professional management     education social science   emphasize teach   research service practical skill building
"Arabic & Islamic Studies, Education, Sciences, Social Sciences & Humanities, Business & Management, IT, Environmental Sciences, Teacher Education",Allama Iqbal Open University,"Islamabad (main), regional campuses nationwide (e.g., Lahore, Sukkur, Multan)",60,limited,"Asias largest open university focusing on distance education from basic to postgraduate levels, offering flexible study options for working students across diverse disciplines","July, August","Morning, Evening",yes,"Matriculation, Intermediate, BA/BS, MA/MSc, B.Ed, M.Ed, MS, MPhil, PhD in Education, Business, Arts, Sciences and IT",asia s large open university focus distance education basic postgraduate level   offer flexible study option work student diverse discipline
"Architecture & Town Planning, Design, Visual Arts, Heritage Studies, Environmental Studies, Cyber Security & Technology","Aror University of Art, Architecture, Design and Heritage, Sukkur",Sukkur (near Rohri),60,yes,"Public sector arts and design university focused on creative disciplines including architecture, multimedia design, textile & fashion, AI & cyber programs integrating artistic and technical skills",Spring/Fall cycles,Morning,Limited,"Bachelor of Architecture (B.Arch), BS Civil Engineering, BS Environmental Science, BS Visual Arts, BS Fashion Design, BS Textile Design, BS Archaeology, BS AI, BS Cyber Security, BS Multimedia & Gaming",public sector art design university focus creative discipline include architecture   multimedia design   textile    fashion   ai    cyber program integrate artistic technical skill
"Computing & IT, Engineering, Management Sciences, Social Sciences, Life Sciences",University of Sahiwal,Sahiwal,Minimum 45-50% in Intermediate (varies by program),"Yes, labs available in science & IT departments","Public university offering BS, MS programs in computing, management, social sciences, and natural sciences. Focus on modern teaching with labs and research opportunities.","Admissions generally open July-August, January",Morning,No,"BS Computer Science, BS Software Engineering, BS Business Administration, BS Economics, BS Psychology, MS, MPhil",public university offering bs   ms program compute   management   social science   natural science   focus modern teaching lab research opportunity
"Computing & IT, Engineering, Management Sciences, Social Sciences, Life Sciences",University of Sargodha,Sargodha,Minimum 50% marks in Intermediate (varies by program),"Yes, equipped labs in science and IT departments",A well-established university offering a wide range of undergraduate and graduate programs with emphasis on research and applied sciences.,Usually January and July intake,Morning and Evening,Partial online application,"BS Computer Science, BS Chemistry, BS Physics, BS Mathematics, BS Business Administration, BS English, MS, MPhil, PhD",establish university offer wide range undergraduate graduate program emphasis research apply science
"Computing & IT, Engineering, Health Sciences, Management Sciences, Social Sciences","University of Science & Technology (often called UST, refers to several campuses - assuming UST, Islamabad)",Islamabad,Generally 50% minimum in relevant subjects,"Yes, labs for computing, engineering, and sciences","Focused on science, technology, and management education with practical labs and modern curriculum for tech and health sciences.","Varies, usually January and August admissions",Morning,"Yes, online applications available","BS Computer Science, BS Biotechnology, BS Software Engineering, BS Microbiology, MBA, MS, PhD",focus science   technology   management education practical lab modern curriculum tech health science
"Computing & IT, Management Sciences, Social Sciences, Engineering",University of Sialkot,Sialkot,Minimum 50% marks in Intermediate,Labs available in computing and engineering departments,"Private university offering BS and MS degrees in computing, business, and engineering with focus on skill development and industry connections.",Twice a year (Spring and Fall),Morning and Evening,Yes,"BS Computer Science, BS Software Engineering, BS Business Administration, BS Electrical Engineering, MS Programs",private university offering bs ms degree compute   business   engineer focus skill development industry connection
"Computing & IT, Engineering, Arts, Social Sciences, Management Sciences",University of Sindh,"Jamshoro, Sindh",Minimum 45-50% marks in Intermediate (varies),"Yes, labs in sciences and engineering","One of the oldest public universities in Sindh offering diverse programs from sciences, arts, engineering, to social sciences with research facilities.",Admissions open January and July,Morning and Evening,Partial online admissions,"BS Computer Science, BS Electrical Engineering, BS English, BS Economics, BS Chemistry, MS, MPhil, PhD",old public university sindh offer diverse program science   art   engineering   social science research facility
"Computing & IT, Engineering, Management Sciences, Social Sciences",University of South Asia,Lahore,Minimum 50% marks in Intermediate,"Yes, labs for IT and business","Private university offering degrees in computing, business, and social sciences with industry-focused curriculum.",Usually July and January intakes,Morning & Evening,Yes,"BS Computer Science, BS Software Engineering, BBA, MBA, MS",private university offer degree compute   business   social science industry focus curriculum
"Computing & IT, Social Sciences, Management Sciences, Life Sciences","University of Sufism and Modern Sciences, Bhitshah Sindh",Bhitshah,Minimum 45-50% marks,Basic labs available,Public university combining traditional Sufi teachings with modern education in sciences and management.,Usually summer and winter intakes,Morning,No,"BS Computer Science, BS Business Administration, BS Psychology, BS Islamic Studies",public university combine traditional sufi teaching modern education science management
"Computing & IT, Engineering, Social Sciences, Management Sciences",University of Swabi,Swabi,Around 50% marks in Intermediate,Labs in computing and sciences,"Public university with focus on computing, engineering, management, and social sciences education.","Annually, typically July and January",Morning,No,"BS Computer Science, BS Software Engineering, BS Management Sciences, BS Social Sciences",public university focus compute   engineering   management   social science education
"Computing & IT, Engineering, Management Sciences, Social Sciences, Life Sciences",University of Swat,Swat,Minimum 50% marks in Intermediate,Well-equipped labs in science & IT,"Public university offering a wide range of programs including sciences, engineering, management with research emphasis.",Admissions mostly in July and January,Morning,No,"BS Computer Science, BS Management Sciences, BS Environmental Science, MS, MPhil",public university offer wide range program include science   engineering   management research emphasis
"Computing & IT, Engineering, Health Sciences, Management Sciences, Social Sciences",University of the Punjab,Lahore (Main campus and sub-campuses),Minimum 50% marks in relevant subjects,Extensive labs and research facilities,"Largest public university in Pakistan offering wide array of undergraduate, graduate, and doctoral programs in all major fields.",Typically July and January,Morning & Evening,Partial online,"BS Computer Science, BS Engineering, MBBS, MBA, MA, MPhil, PhD",large public university pakistan offer wide array undergraduate   graduate   doctoral program major field
"Computing & IT, Engineering, Management Sciences, Social Sciences",University of Turbat,"Turbat, Balochistan",Minimum 45-50% marks,Labs available in computing and sciences,"Public university offering programs in computer science, management, social sciences, and natural sciences with focus on regional development.",Admissions usually in July and January,Morning,No,"BS Computer Science, BS Business Administration, BS Environmental Sciences, MS programs",public university offering program computer science   management   social science   natural science focus regional development
"Computing & IT, Veterinary Sciences, Agriculture, Life Sciences",University of Veterinary & Animal Sciences,Lahore,Minimum 50% marks in relevant subjects,Well-equipped labs and animal research facilities,"Premier university specializing in veterinary and animal sciences, agriculture, and allied health sciences with research focus.","Twice a year, January and July",Morning,Partial online,"DVM (Doctor of Veterinary Medicine), BS Animal Sciences, BS Dairy Technology, MS, PhD",premier university specialize veterinary animal science   agriculture   ally health science research focus
"Computing & IT, Engineering, Management Sciences, Social Sciences",University of Wah,"Wah Cantt, Punjab",Minimum 50% marks in Intermediate,Fully equipped labs in engineering and computing,"Public university focused on engineering, computing, and management sciences with strong industry linkages.",Annually in January and July,Morning and Evening,Yes,"BS Electrical Engineering, BS Mechanical Engineering, BS Computer Science, BBA, MBA",public university focus engineering   computing   management science strong industry linkage
"Computing & IT, Social Sciences, Management Sciences",Virtual University of Pakistan,Islamabad (Online),Minimum 45-50% marks,"No physical labs, virtual labs available",Pakistans premier online university offering flexible and accessible undergraduate and postgraduate programs via virtual learning.,Rolling admissions throughout the year,Flexible (online),Yes,"BS Computer Science, BS Business Administration, MBA, MA English, MS programs",pakistan s premier online university offering flexible accessible undergraduate postgraduate program virtual learning
"Computing & IT, Social Sciences, Management Sciences",Women University Mardan,"Mardan, Khyber Pakhtunkhwa",Minimum 45% marks in Intermediate,Labs available for science and IT departments,"Public womens university offering diverse programs in sciences, management, social sciences, and computing aimed at empowering women education.",Usually July and January admissions,Morning,No,"BS Computer Science, BS Management Sciences, BS Psychology, MS programs",public woman s university offer diverse program science   management   social science   computing aim empower woman education
"Computing & IT, Social Sciences, Management Sciences, Life Sciences",Women University of Azad Jammu & Kashmir,"Bagh, Azad Jammu & Kashmir",Minimum 45-50% in Intermediate,Labs available for sciences and IT,"Womens university offering programs in social sciences, life sciences, management, and computing to promote higher education for women in the region.",Usually January and July,Morning,No,"BS Computer Science, BS Management Sciences, BS Zoology, MS programs",woman s university offering program social science   life sciences   management   compute promote high education woman region
"Computing & IT, Social Sciences, Management Sciences","Women University, Swabi","Swabi, Khyber Pakhtunkhwa",Minimum 45% marks,Labs available in IT and sciences,"Public university for women with focus on computing, management, and social sciences education to empower female students.",Annually in January and July,Morning,No,"BS Computer Science, BS Business Administration, BS Psychology, MS programs",public university woman focus compute   management   social science education empower female student
"Computing & IT, Health Sciences, Social Sciences",Zia-ud-Din University,Karachi,Minimum 50% in Intermediate,Labs available for health sciences and computing,"Private university offering programs in health sciences, computing, and social sciences with focus on practical and research-based education.",Admissions twice yearly (January and July),Morning and Evening,Yes,"BS Computer Science, BS Health Sciences, BBA, BS Psychology, MS programs",private university offering program health science   computing   social science focus practical research base education
"Computing & IT, Management Sciences, Social Sciences",University of Sahiwal,Sahiwal,Minimum 45-50% marks,Labs available for sciences and IT,"Public university offering undergraduate and graduate programs across computing, management, and social sciences.",Typically July and January,Morning,No,"BS Computer Science, BS Business Administration, MS, MPhil",public university offering undergraduate graduate program compute   management   social science
"Computing & IT, Management Sciences, Social Sciences",University of Sargodha,Sargodha,Minimum 50% marks in Intermediate,Labs available,"Comprehensive public university offering programs in computing, management, social sciences, and natural sciences.",July and January intakes,Morning and Evening,Partial online application,"BS Computer Science, BS Business Administration, MS, MPhil, PhD",comprehensive public university offering program compute   management   social science   natural science
"Computing & IT, Engineering, Social Sciences, Management Sciences",University of Science & Technology,Bannu / Islamabad (depends on campus),Minimum 50% in relevant subjects,"Labs available in computing, engineering, and sciences","Public university focusing on applied sciences, technology, and management programs with lab-based and research-oriented teaching.",Admissions generally January & July,Morning,Partial online,"BS Computer Science, BS Software Engineering, BS Biotechnology, MS, MPhil",public university focus applied science   technology   management program lab base research orient teaching
"Computing & IT, Business, Management, Social Sciences","University of Sialkot, Sialkot",Sialkot,Minimum 50% marks in Intermediate,Labs for IT & engineering programs,"Private university offering undergraduate and graduate programs in computing, business, and management with focus on industry readiness.",Twice yearly  Spring & Fall,Morning & Evening,Yes,"BS Computer Science, BS Software Engineering, BBA, MBA, MS",private university offering undergraduate graduate program compute   business   management focus industry readiness
